{
  "frameworkId": "nis2",
  "label": "EU NIS2",
  "version": "2022/2555",
  "description": "Network and Information Security Directive 2 — EU directive requiring cybersecurity risk management measures and incident reporting obligations for essential and important entities across EU member states.",
  "homepageUrl": "https://www.enisa.europa.eu/topics/cybersecurity-policy/nis-directive-new",
  "css": "fw-nis2",
  "totalControls": 30,
  "registryKey": "nis2",
  "csvColumn": "Nis2",
  "displayOrder": 18,
  "scoring": {
    "method": "requirement-compliance"
  },
  "colors": {
    "light": {
      "background": "#ecfeff",
      "color": "#155e75"
    },
    "dark": {
      "background": "#083344",
      "color": "#67e8f9"
    }
  }
}
