{
  "frameworkId": "iso-27002",
  "label": "ISO/IEC 27002:2022",
  "version": "2022",
  "description": "International standard providing a reference set of information security controls and guidance for their implementation. ISO 27002 is the implementation guide behind ISO 27001 Annex A — it specifies the 93 controls that organizations select from when treating identified risks.",
  "homepageUrl": "https://www.iso.org/standard/75652.html",
  "css": "fw-iso27002",
  "totalControls": 93,
  "registryKey": "iso-27002",
  "csvColumn": "Iso27002",
  "displayOrder": 20,
  "scoring": {
    "method": "control-coverage",
    "themes": {
      "5": {
        "label": "Organizational Controls",
        "controlCount": 37
      },
      "6": {
        "label": "People Controls",
        "controlCount": 8
      },
      "7": {
        "label": "Physical Controls",
        "controlCount": 14
      },
      "8": {
        "label": "Technological Controls",
        "controlCount": 34
      }
    }
  },
  "colors": {
    "light": {
      "background": "#ccfbf1",
      "color": "#0f766e"
    },
    "dark": {
      "background": "#134e4a",
      "color": "#5eead4"
    }
  }
}
