{
  "frameworkId": "gdpr",
  "label": "EU GDPR",
  "version": "2016/679",
  "description": "General Data Protection Regulation — EU regulation governing data protection and privacy for individuals in the EU and EEA, with extraterritorial scope for organizations processing EU residents' data.",
  "homepageUrl": "https://gdpr.eu/",
  "css": "fw-gdpr",
  "totalControls": 99,
  "registryKey": "gdpr",
  "csvColumn": "Gdpr",
  "displayOrder": 15,
  "colors": {
    "light": {
      "background": "#fef3c7",
      "color": "#92400e"
    },
    "dark": {
      "background": "#451a03",
      "color": "#fcd34d"
    }
  },
  "scoring": {
    "method": "control-coverage"
  }
}
